"DESCRIPTION","DURATION IN MS","NAME","PARENT SUITE","START TIME","STATUS","STOP TIME","SUB SUITE","SUITE","TEST CLASS","TEST METHOD"
"","1261","test the route without basic auth","","Fri Oct 03 01:23:42 UTC 2025","passed","Fri Oct 03 01:23:43 UTC 2025","","test the gateway configuration function","",""
"","6290","add a route to the service","","Fri Oct 03 01:23:15 UTC 2025","passed","Fri Oct 03 01:23:21 UTC 2025","","test the gateway configuration function","",""
"","7824","add a gateway service","","Fri Oct 03 01:23:07 UTC 2025","passed","Fri Oct 03 01:23:15 UTC 2025","","test the gateway configuration function","",""
"","61367","test the route with exceeding the rate limit","","Fri Oct 03 01:23:43 UTC 2025","passed","Fri Oct 03 01:24:44 UTC 2025","","test the gateway configuration function","",""
"","6494","add a new consumer","","Fri Oct 03 01:23:27 UTC 2025","passed","Fri Oct 03 01:23:33 UTC 2025","","test the gateway configuration function","",""
"","5006","add the basic auth plugin to the route","","Fri Oct 03 01:23:22 UTC 2025","passed","Fri Oct 03 01:23:27 UTC 2025","","test the gateway configuration function","",""
"","8342","add the rate limiting plugin to the route","","Fri Oct 03 01:23:33 UTC 2025","passed","Fri Oct 03 01:23:42 UTC 2025","","test the gateway configuration function","",""
